{
  "schemaVersion": "protocol-lab.dns-wire-fixture.v1",
  "fixtureId": "dns.plab-test-a.canonical",
  "description": "Canonical plab.test. IN A query and authoritative response.",
  "upstreamStandards": [
    "https://www.rfc-editor.org/rfc/rfc1035",
    "https://www.rfc-editor.org/rfc/rfc6761",
    "https://www.rfc-editor.org/rfc/rfc5737"
  ],
  "question": {
    "name": "plab.test.",
    "type": "A",
    "class": "IN"
  },
  "messages": {
    "query": {
      "messageId": 0,
      "flags": [],
      "sectionCounts": {
        "question": 1,
        "answer": 0,
        "authority": 0,
        "additional": 0
      },
      "bareWire": {
        "hex": "00000000000100000000000004706c616204746573740000010001",
        "lengthBytes": 27,
        "sha256": "c46b9fb76019b5a644d0884b17e816cb7c3076275d9468c27d180f70488eb8ec"
      }
    },
    "canonicalResponse": {
      "messageId": 0,
      "flags": ["QR", "AA"],
      "responseCode": "NOERROR",
      "sectionCounts": {
        "question": 1,
        "answer": 1,
        "authority": 0,
        "additional": 0
      },
      "answers": [
        {
          "owner": "plab.test.",
          "type": "A",
          "class": "IN",
          "ttlSeconds": 0,
          "rdata": "192.0.2.1"
        }
      ],
      "bareWire": {
        "hex": "00008400000100010000000004706c616204746573740000010001c00c00010001000000000004c0000201",
        "lengthBytes": 43,
        "sha256": "9d488461675ad5ab9f74c7b203861e1ad17521e413a407a25e6611012a595620"
      }
    }
  },
  "transportFraming": {
    "dot": {
      "framing": "length-prefixed-dns-message",
      "lengthPrefixOctets": 2,
      "byteOrder": "network",
      "canonicalQueryWireHex": "001b00000000000100000000000004706c616204746573740000010001",
      "canonicalResponseWireHex": "002b00008400000100010000000004706c616204746573740000010001c00c00010001000000000004c0000201"
    },
    "doq": {
      "framing": "length-prefixed-dns-message",
      "lengthPrefixOctets": 2,
      "byteOrder": "network",
      "canonicalQueryWireHex": "001b00000000000100000000000004706c616204746573740000010001",
      "canonicalResponseWireHex": "002b00008400000100010000000004706c616204746573740000010001c00c00010001000000000004c0000201"
    },
    "doh2": {
      "framing": "bare-dns-message-body",
      "mediaType": "application/dns-message",
      "queryBodySource": "messages.query.bareWire.hex",
      "responseBodySource": "messages.canonicalResponse.bareWire.hex"
    },
    "doh3": {
      "framing": "bare-dns-message-body",
      "mediaType": "application/dns-message",
      "queryBodySource": "messages.query.bareWire.hex",
      "responseBodySource": "messages.canonicalResponse.bareWire.hex"
    }
  },
  "runtimeIdPolicy": {
      "doh2": {
        "messageId": "zero",
        "canonicalHashNormalization": "identity"
      },
      "doh3": {
        "messageId": "zero",
        "canonicalHashNormalization": "identity"
      },
      "doq": {
        "messageId": "zero",
        "canonicalHashNormalization": "identity"
    },
    "dot": {
      "messageId": "unique-among-outstanding-queries",
      "canonicalHashNormalization": "set-message-id-to-zero"
    }
  },
  "responseNormalization": {
    "rawResponseEqualityRequired": false,
    "compressionMayDiffer": true,
    "procedure": [
      "parse-dns-message",
      "canonical-reserialize",
      "compare-normalized-sha256"
    ]
  }
}
